{
  "components": [
    {
      "filename": "gcc-6.3.0.tar.bz2",
      "format": "tar.bz2",
      "name": "gcc-source",
      "provides": [
        "gcc",
        "g++",
        "gccgo",
        "gfortran"
      ],
      "role": "source",
      "sha256": "f06ae7f3f790fbf0f018f6d40e844451e6bc3b7bc96e128e63b09825c1f8b29f",
      "upstream": "GNU FTP",
      "url": "https://ftp.gnu.org/gnu/gcc/gcc-6.3.0/gcc-6.3.0.tar.bz2",
      "version": "6.3.0"
    }
  ],
  "install": "source build",
  "language": "c/c++",
  "platform": {
    "arch": "x86_64",
    "libc": "gnu",
    "os": "linux"
  },
  "release_date": "2016-12-21",
  "schema_version": 3,
  "software": "gcc",
  "version": "6.3.0"
}