{
  "components": [
    {
      "bundled_components": {
        "npm": "5.3.0"
      },
      "filename": "node-v8.5.0-linux-x64.tar.xz",
      "format": "xz",
      "name": "nodejs",
      "provides": [
        "node",
        "corepack"
      ],
      "role": "runtime",
      "sha256": "a9651fcc6259b4a944ebb72e6dd116602c7b26ddf939599b060d1d3e6ead8c36",
      "url": "https://nodejs.org/dist/v8.5.0/node-v8.5.0-linux-x64.tar.xz",
      "version": "8.5.0"
    },
    {
      "filename": "npm-5.3.0.tgz",
      "format": "tgz",
      "name": "npm",
      "paired_with": {
        "nodejs": "8.5.0"
      },
      "provides": [
        "npm",
        "npx"
      ],
      "role": "package-manager",
      "sha256": "dd96ece7cbd6186a51ca0a5ab7e1de0113333429603ec2ccb6259e0bef2e03eb",
      "url": "https://registry.npmjs.org/npm/-/npm-5.3.0.tgz",
      "version": "5.3.0"
    }
  ],
  "language": "javascript",
  "platform": {
    "arch": "x86_64",
    "libc": "gnu",
    "os": "linux"
  },
  "schema_version": 3,
  "software": "nodejs",
  "version": "8.5.0"
}