{
  "components": [
    {
      "filename": "ruby-3.1.7.tar.gz",
      "format": "tar.gz",
      "name": "ruby",
      "provides": [
        "ruby"
      ],
      "role": "runtime",
      "sha256": "0556acd69f141ddace03fa5dd8d76e7ea0d8f5232edf012429579bcdaab30e7b",
      "url": "https://cache.ruby-lang.org/pub/ruby/3.1/ruby-3.1.7.tar.gz",
      "version": "3.1.7"
    }
  ],
  "install": "source build",
  "language": "ruby",
  "platform": {
    "arch": "x86_64",
    "libc": "gnu",
    "os": "linux"
  },
  "schema_version": 3,
  "software": "ruby",
  "version": "3.1.7"
}