{
  "components": [
    {
      "filename": "gcc-7.2.0.tar.xz",
      "format": "tar.xz",
      "name": "gcc-source",
      "provides": [
        "gcc",
        "g++",
        "gccgo",
        "gfortran"
      ],
      "role": "source",
      "sha256": "1cf7adf8ff4b5aa49041c8734bbcf1ad18cc4c94d0029aae0f4e48841088479a",
      "upstream": "GNU FTP",
      "url": "https://ftp.gnu.org/gnu/gcc/gcc-7.2.0/gcc-7.2.0.tar.xz",
      "version": "7.2.0"
    }
  ],
  "install": "source build",
  "language": "c/c++",
  "platform": {
    "arch": "x86_64",
    "libc": "gnu",
    "os": "linux"
  },
  "release_date": "2017-08-14",
  "schema_version": 3,
  "software": "gcc",
  "version": "7.2.0"
}