{
  "components": [
    {
      "filename": "php-8.3.35.tar.xz",
      "format": "tar.xz",
      "name": "php-source",
      "provides": [
        "php",
        "php-cli",
        "php-fpm",
        "phpize"
      ],
      "role": "source",
      "sha256": "ff4630fbbbd94359134b7d3c223db59329905bdc4f5a9ef93d257b48e358619a",
      "url": "https://www.php.net/distributions/php-8.3.35.tar.xz",
      "version": "8.3.35"
    }
  ],
  "install": "source build",
  "language": "php",
  "platform": {
    "arch": "x86_64",
    "libc": "gnu",
    "os": "linux"
  },
  "schema_version": 3,
  "software": "php",
  "version": "8.3.35"
}