{
  "components": [
    {
      "filename": "OpenJDK11U-jdk_x64_linux_hotspot_11.0.32.1_1.tar.gz",
      "format": "tar.gz",
      "name": "jdk",
      "provides": [
        "java",
        "javac"
      ],
      "role": "runtime",
      "sha256": "5c3f68887c325d36d852ba534303e1f5f1f5cae7d6cc1e951d73e0d8e98a058d",
      "upstream": "Eclipse Temurin (Adoptium)",
      "url": "https://github.com/adoptium/temurin11-binaries/releases/download/jdk-11.0.32.1%2B1/OpenJDK11U-jdk_x64_linux_hotspot_11.0.32.1_1.tar.gz",
      "version": "11.0.32.1"
    }
  ],
  "language": "java",
  "platform": {
    "arch": "x86_64",
    "libc": "gnu",
    "os": "linux"
  },
  "schema_version": 3,
  "software": "java",
  "version": "11.0.32.1"
}